Star,Feedback1,"С первого применения пошла аллергия.Красные пятна. Смутила сама упаковка крема.Стояла пломба на коробке от крема,которую в пункте выдачи сказали нельзя снимать.На самой баночке крема не было никакой защитной плёнки или фольги."
3,"Тестирую крем неделю. Пока скорее нет, чем да. Слишком жирный, впитывается плохо. Даже после 3 часов после нанесения крем до конца не впитался и остаётся неприятный липкий слой на лице. Попробую использовать его как ночной. А вот сыворотка другого бренда мне подошла идеально."
5,"Хорошо упаковано, запах приятный"
5,Все хорошо 
4,несовсем то
4,"Крем неплохой,хорошо впитывается и увлажняет ❤️"
5,"Приятный запах, не оставляет жирного блеска. Хорошо увлажняет"
5,"Очень хороший крем, а главное качественный! Хорошо увлажняет, спасибо!"
5,Прекрасно пахнет
3,Слишком жирный крем.
5,"Упаковка 📦 супер !!!! Пришло все в целости! Запечатано качественно . Прям приятно получать такие Товары. По действию пока не знаю, взяла на замену предидущему уходу… уж ооооооч подорожал. Посмотрим, надеюсь подойдёт ."
5,Пришло всё целое коробка 📦 целая. Текстура крема мягкая и хорошо ложиться. Здесь покупаю впервые и хочу сказать приятно удивлена. Раньше предпочитала брать косметику только в специализированных магазинах. Спасибо
5,товар хорошо упакован. 
5,"Крем пришёл не вскрытый, целый, с хорошим сроком годности. Качеством крема также довольна!))"
5,Крем очень понравился.
5,"Быстрая доставка, очень хорошо упаковано, давно пользуюсь этим кремом."
5,"Товаром очень довольна, нежная текстура, чувство увлажненности сохраняется на целый день."
5,"Один из моих любимых кремов. 
Всё отлично. Спасибо)"
3,"Крем пришел в коробочке, на крышке отсутствовала защитная пленка, под крышкой нет защитной фольги. Отказ."
5,Крем пришёл хорошо упакованный. Качество понравилось.
5,Я его обожаю 😻 отлично увлажняет 
5,"ОК, хорошо увлажняет кожу."
5,"Крем понравился, хорошо увлажняет кожу, идеально подходит для нанесения под пудру."
4,"Крем понравился. Хорошо увлажняет кожу, хорошо впитывается не оставляет жирного блеска. Рекомендую."
5,Как обычно быстро и качественно.
5,Крем отличный
3,"Не хочу сказать не чего плохого, наверно это индивидуальная аллергия на компонент. У мамы ужасные отеки на него и стягивает кожу. Сама попробовала намазаться и утром офигела тоже от отеков. Доставка быстрая, все было упаковано и закрыто "
5,Все отлично!
1,"Не знаю насколько это качественный и 100% не поддельный товар, вызвал аллергию"
4,"Крем пришёл без слюды. Надеюсь, что все же это оригинал, а не качественная подделка. Консистенция и запах, как в оригинальном креме.  "
5,"Крем хорошо увлажняет, не блестит на лице, мне нравится.Спасибо!"
5,"Нежная текстура, быстро впитывается. Крем очень понравился. Буду ещё брать"
5,Крем очень понравился.  Можно брать и цена приятная.
5,Эта линейка крема очень даже нечего
3,"Выглядит так, как будто не доложили крем и по всей баночке некрасиво размазано. Упаковку бы тогда меньше использовали , раз половины почти нет"
5,Очень очень хороший
2,Не самый лучший крем за эту цену 
5,Мне очень нравится этот крем!!!
5,"Мне понравилась текстура и аромат об эффекте пока не могу ни чего сказать так как пользуюсь один день но ни каких не приятных ощущений нет
"
5,"Хороший, хорошо увлажняет кожу"
5,ОК мне нравится большое спасибо
1,"Коробка из под крема потрепана, нет защитной пленки ни на коробке, ни на баночке. Ужас"
5,Пока ещё не пробовала. Пришел целый коробка не помята
5,Крем супер!
5,😍😍😍😍 Классные
5,"Немного лицо блестит после него,но в целом нравится "
5,"Крем очень понравился , жирненький "
5,"Супер крем, пришел быстро"
5,Крем обалденный. Даже после первого нанесения на кожу чувствуется результат. Кожа мягкая и сияет.
5,"Здравствуйте.Беру не в первый раз, очень нравится вся серия кремом."
5,Пришло всё хорошо упаковано. Рекомендую. спасибо.
5,"Крем супер. Очень понравился, буду еще заказывать"
5,"Крем упакован хорошо, коробка, баночка целые, всё запечатано, с контролем первого вскрытия. Спасибо продавцу"
5,Упаковано было в гофро  коробку. Коробочка от крема целая. Всё запечатано. Текстура и аромат приятные . Кожа после крема бархатная и нежная. Посмотрю как дальше будет восприниматься кожей)
5,"Хороший крем , пришел упакован в картонную  коробочку , все целое ,ничего не помялось, коробочка с кремом без слюды, но она и магнит косметик тоже точно такая же, специально посмотрела."
5,Все отлично
5,"покупаю уже 3 раз . Но в этот раз коробка пришла не запаенная в целофан, как бывает обычно. Может - это связано с ""теневым импортом""?)))"
4,"Цена решает, упаковка неуд."
5,Крем супер. И цена хорошая. Спасибо продавцу.
5,Очень хороший крем
5,"Пришло быстро , всё целое."
5,Пользуюсь давно. Очень нравится)
5,Всё супер👍
2,"Крем пришёл вскрытый, пришлось вернуть "
5,Крем понравился. Упаковано хорошо
5,Крем супер
3,"Упакован в картонную коробочку, а внутренняя упаковка крема нарушена и видно продавцом.Не приятно..."
5,Хороший крем
5,"Хороший крем, использую после бассейна. Запах приятный и быстро впитывается"
5,Хороший крем.
5,"Крем хороший, но для меня чуть жирноват, а вот маме подошло. Заказ пришёл быстро, спасибо продавцу"
5,"Хороший дневной крем, упаковка полностью запечатана, есть защитная пленка и на коробке и на баночке. Срок годности приличный. Сам крем нежный, впитывается хорошо."
5,Всегда беру отличный крем
5,Обожаю этот крем
5,Товар пришёл без повреждений. Крем приятной текстуры.
5,Крем беру 2раз. Довольна
5,Все отлично
5,"Пришло быстро, все целое, упаковано хорошо. Про качество пока её могу сказать, не пользовалась"
4,Целостность упаковки не нарушена. Запах крема приятный
5,"Отличный крем, советую всем, кожа увлажненная 24ч.)))"
5,Хорошая маска.
5,Отличный крем и упаковка
5,"Отличный крем, жирноват, но для моей сухой кожи-самое то)"
5,Мне оч. подошёл!
5,"Крем хороший, беру не первый раз."
5,"Кожа после крема бархатистая! Много кремов перепробовала, такого эффекта давно не ощущала ❤️👍🏼"
5,Очень хороший и приятный крем советую 
5,Хороший !!!!!!!!!!!!!!!
5,"Хороший крем. Упакован в дополнительную коробку, за что отдельное спасибо!"
5,"Крем хороший, но пришёл без плёнки, очень долго ждала доставку"
3,"Крем не понравился, не подошёл и, лично для меня, очень навязчивый запах у крема"
5,"Крем хороший, пользуюсь и дневным и ночным"
5,Крем понравился
5,"Крем крутой,рекомендую)"
2,"Очень нравится этот крем, именно эта серия. Но показалось, что этот крем, который я заказала на вайлдбериз отличается от того, который я обычно покупала в магазине. Сейчас он дороже в магазине, но лучше переплатить. "
5,Отличный крем 
5,Отлично работает! Особенно в паре день-ночь. 
5,"Очень нравится этот крем. Лёгкая текстура, приятный запах"
5,"Брала за 391р,пришло все целое и хорошо запокованное, запах ооочень приятный, эффект есть 👍"
2,"Заказываю третий раз, два раза первых пять звёзд, очень нравился, а в этот раз пришёл, коробочка вскрыта и баночка тоже вскрывалась, очень жаль, что сразу не проверила, т. К был упакован в большой слой защитной плёнки, надеялась что всё хорошо будет. Очень растроена, буду надеяться, что крем соответствует тому, что до этого покупала"
5,Идеальный крем!!!
5,Всё хорошо 
5,Отличный крем
5,"Хороший крем, мне понравился. Более жирный и питательный, чем возраст эксперт, мне как раз сейчас такой и нужен для сухой кожи. Все подошло, никакой негативной реакции не было, но мне вообще крема лореаль подходят. Пахнет приятно"
5,Понравился
5,Отлично увлажняет. Приятный запах
5,"Мне понравился,ложиться очень легко,быстро впитывается,увлажняет и пахнет приятно"
1,"Моя кожа не склона к аллергиям, но после этого крема - жесть. Во-первых он жирнющий с явным химическим запахом отдушек. Во-вторых после него появились покраснения на коже. Думала, что просто не подошёл. Отдала свекрови. Она намазалась 1 раз и у неё опухло все лицо. Пришлось идти к врачу, пить таблетки, чтоб спал отёк. Жуть. Так было недели 2… никому не советую и точно не разделяю положительные отзывы. Дешевая химическая мазилка, совсем не уровня Лореаль. "
5,Пользуюсь им уже давно. Нравиться. Быстро впитывается. Приятно пахнет
5,"Товар пришёл целый, с хорошим сроком годности"
3,"Эффект вау не заметила, крем как крем"
5,Отличный крем!
5,"Упакован в картонную коробку. Коробочка крема идеальная. Сам крем точно не поделка. Ну а качество крема отличное, покупаю второй раз"
5,"Любимый крем ! Нежный , не жирный , очень приятный. Пришёл хорошо , аккуратно упакованный. "
5,Хороший приятный крем
5,"Обожаю этот крем! Единственный нежный, ничего не щиплет от него никогда. Приятно питает, не липкий, идеальный! И ночной у меня такой же - самые лучшие крема из всех что пробовала в разной ценовой категории! "
5,Отличный крем!
5,Хороший крем👌пришло все целое 
5,Хороший крем.
4,Хорошо питает кожу лица
4,"Крем хороший, пришёл целый не вскрытый, покупала за 390₽, сейчас уже дороже стоит. Использовала один раз, лицо покраснело. Не знаю в чем дело.. "
5,Отличный крем ! Хорошо увлажняет !
5,"Много раз заказываю этот крем в этом магазине.все отлично! Только вот цена на него подскочила( был 320,сейчас 470("
5,Крем хороший
5,"Пришло все целое, качеством довольна!"
5,"Дешевле чем в магазине , хорошо увлажняет , не оставляет жирно пленки на лице "
5,"Хороший крем, увлажняет, быстро впитывается и не оставляет липкости "
5,Товаром довольна.
5,"Приятный на ощупь, хорошо впитывается."
2,"Качество крема пока оценить не могу. Впечатление уже испорчено до использования. По фото видно, что вскрытый, и для чего-то маленькую наклеечку неправильно назад приклеили. Жалко, что не сама получала. Обидно конечно., обязательно бы отказалась. А теперь все. Вообще, упаковка не продумана совершенно, крем никак не защищен, к другим кремам этой серии это относится тоже."
5,Очень понравился спасибо!
5,"Пришёл быстро. Упакован очень хорошо, не вскрыт"
2,"Коробка с кремом не упаковано в пленку, как это обычно бывает, поэтому 3 звёзды.
Надеюсь качество крема не подведёт,  внутри баночки  виднеется что то чёрное.
Защитной фольги тоже не было (не помню должна ли она быть у этой серии кремов)."
5,Крем Хороший жене нравиться.
5,"Хороший Крем,беру постоянно!"
5,"Скажу кратко, крем понравился."
5,"Нежная текстура, моя кожа очень довольна"
5,"Уже второй раз покупаю . Очень хороший крем , увлажняет кожу."
5,Всё понравилось.
3,Хорошо увлажняет кожу
5,Очень хороший крем
5,Отличный крем. Постоянно его тут беру
5,Полностью устоила
5,"Рекомендую,  заказываю не в первый раз."
5,Коротко:я довольна
5,Отличный крем👍
5,"Упакован в коробку, спасибо!"
5,Крем супер
5,Очень хороший крем
5,"Отличный крем, приятный, лёгкий."
5,"Хороший крем, уже раза 4 делаю заказ."
5,"Отличный крем, хорошо питает кожу,  беру не первый раз"
4,"Цвет и плотность коробки отличается от купленных ранее в магазинах кремов этой серии, нет защитной пленки на коробке она просто заклеина слюдой, хотя ранее никогда не покупала его без защитной пленки на коробке. Данные факты не могут не огорчать и наводить на мысли, а оригинал ли это? Текстура крема не плохая похожа на тот, что покупала ранее, тестирование меньше суток пока все нормально посмотрю как будет ранее."
5,Все офигенно
5,"Хороший крем, беру второй раз"
5,Пока всё хорошо. Будем пользоваться. Пришёл быстро.
5,"Отличный крем, приятный запах"
5,Довольна! Пользуюсь постоянно
5,"Крем классный, очень хорошо освежает"
5,"Крем пришел быстро,упаковка не повреждена.Жирный,но для моей сухой кожи самое то.Блеск есть но не большой ."
2,Упаковка без слюды. Отказ.
5,"Запах супер, на лице тоже"
4,"Крем неплохой,но немного тяжеловат,впитывается не сразу,хотя заявлен как хорошо увлажняющий кожу крем."
3,"Странная упаковка и мятая. Думаю, что подделка."
5,"Крем пришёл целый, доставка быстрая! Спасибо!"
5,"Отличный крем, хорошо увлажняет"
5,Рекомендую. Пришло все целое.
1,Пришёл без салафановой упаковки очень подозрительно
3,"Пришёл без коробки, ленточка была порвана, крем очень жидкий."
5,"Всё хорошо, крем нравится. Спасибо."
2,Товар пришёл целый. В деле ещё не пробовала.
4,"Классный крем,жирный как и хотела,но под крышкой не было плёнки"
5,На размер маломер
4,"Крем плотный до конца не впитывается и остаётся блеск на коже. У меня комби кожа, пользуюсь в первые, но как-то не очень. Буду пока продолжать лишь бы не обсыпало лицо, аллергии нет, но из-за блеска на лице и липкости не очень нравится. Не очень он мне подошёл."
5,"Крем очень легкий , нежирный с приятным запахом.  Кожу увлажняет хорошо. Мне очень понравился."
4,"Коробка пришла целая (на удивление, так как в последнее время товар постоянно мятый). Слюды на коробке нет, только наклейка. Внутри защитной крышки нет. Срок обозначен. Банка с защитной лентой. Крем по качеству понравился, но запах, увы, нет... Хотя пользуюсь продукцией этой фирмы давно и брала разные. Рекомендую понюхать пробник перед продажей. (хотя тоже не факт)) На лице приятный - не жирный и не лёгкий. Мне подходит. Насколько эффективен посмотрю. "
1,"Запах интенсивный до головокружения, не выдержала и смыла через 10 минут. Никогда такого не было со мной. Крем плохо впитывается, оставляет липкость"
5,"Доставка быстрая, упаковано хорошо, в действии еще не пробовала."
3,Щиплет кожа после него 
1,"Крем вообще не тот,не оригинал!!! Банка от оригинала,а внутри дешевая подделка без запаха,даже цвет и консистенция другие,густой и жирный,даже рядом не стоял с оригиналом,ужас просто. Я много лет пользуюсь только им,сразу поняла,что не он.Качество отврат."
5,Крем супер. Я очень довольна и пользуюсь только им. Спасибочки
5,Крем очень хороший. Покупаю уже не первый раз.
5,"Даже комментарии не нужны, все просто супер в очередной раз"
4,"Возможно мне не подошёл, хотя написано, что для всех типов кожи. У меня комбинированная и для меня он жирноват, как дневной. Блестит на лице. 
В описании к крему вообще написано, что он ночной  (фото прилагаю)"
5,"Всегда покупаю этот крем,он  идеален!!!!Упакован в коробку,швы коробки заклеены скотчем,доставили всё в шикарном виде,быстро!!!Спасибо получила огромное удовольствие от заказа,молодцы!!!!"
5,"Первый раз попробовала этот крем, ничего плохого сказать не могу, нравится "
5,Крем бомба
5,"Пришел, быстро, но купила дороже..."
1,"Жуткая аллергия. Раздулось лицо так, что пришлось вызывать скорую помощь, 4 день отхожу. "
5,"Быстрая доставка, всё хорошо запаковано , продавца рекомендую."
5,"Пришло всё в целости и сохранности, упакован крем хорошо, крем заказала первый раз, буду пробовать решила взять по отзывам. Спасибо)"
5,"Пришёл во время, упаковка целая"
5,"Крем пришёл хорошо упакован, всё в порядке. Спасибо."
