Star,Feedback
4,"Искала крем или гель на лето с гиалуроновой кислотой и защитой от солнца в одном флаконе. Думала, что нашла, но этот крем мне не особо подошел. У меня смешанная кожа, и там, где она нормальная или сухая - крем впитывается хорошо. А вот на жирных участках крем впитывается долго и неохотно. Затем, когда выходишь на солнце - на этих жирных участках создается ощущение пленки, и лицо начинает потеть и блестеть. Придется оставить его на зиму, или отдать маме. Ей он вроде как подошел. А так вообще крем пришел упакованный, с защитными пленочками. Запах и текстура приятные."
2,"Крем возможно не плохой, но у меня от него пошла аллергическая реакция. Не рекомендую"
5,"Крем хороший, брала в первый раз. Быстро впитывается, под макияж не подойдёт "
4,"Запах приятный, но не понравилось, что коробка была помята и будто вскрыта уже, и не было защитной пленки сверху крема."
5,"Взяла первый раз, крем хороший, но для лета жирноват!"
5,Отличный крем.
3,Не вижу эффекта. Пользуюсь 3 месяца
5,Классный крем!!! Буду заказывать еще
5,Приятна легкая текстура. Не таит во время потоотделения
5,Увлажняет не липнет быстро впитывается)))и дешевле чем во всех косметических магазинах)
5,"Доставлен быстро, упакован хорошо, смутило отсутствие защитной мембраны под крышкой... Опробовала, пахнет приятно, хорошо впитывается, не оставляет блеска. Раньше таким не пользовалась. Посмотрим, как будет в деле. Спасибо за цену и качество."
5,"Крем немного жирноват для моей кожи, но это не критично. В целом текстура сне понравилась, буду пользоваться."
5,"Замечательный крем таким пользуюсь давно , единственный момент не знаю где оставить отзыв о доставке пожалуйста сотрудники, которые отправляют и  упаковывают товар будьте внимательны!! неоднократно замечено, заклеивают стикером сроки годности! не делайте так больше, невозможно проверить приходится отдирать всё с мясом.."
5,Отличный крем
5,"Мне нравится эта серия (и ночной, и для глаз). Только вот на зиму дневной увлажняющий нельзя, надо будет искать замену на холодное время."
5,"Пришел в отличном состоянии, полностью закрыт в пакет запаянный."
5,"Хороший крем, ни первый раз заказываю."
5,"Мне крем подошёл, крем супер"
5,Хороший крем.
5,"отличный крем. ненавязчивый запах чистоты. текстура очень приятная. хорошо впитывается, увлажняет. кожа не жирнится и не сушится. расход небольшой. пользуюсь почти месяц.
упаковано было отлично - контроли вскрытия как на баночке, так и на коробочке с двух сторон. коробка была упакована в пурырку и в ещё один герметичный пакет 🙌 все целое. однозначно рекомендую. и цена приятная - намного выгоднее чем в магазине. заказала ещё один на подарок"
5,"Очень хороший бюджетный крем , заказываем с мамой уже больше года, всегда все устраивает)советую "
5,Отличный крем. Заказываю уже второй раз. Запах просто бомба. Для моей жирной кожи идеальный вариант. Хорошо увлажняет без липкой пленки на лице
5,"Минус один - мятая коробочка. Но сам крем очень нежный, текстурный, лицо увлажнено, я с него балдею. Спасибо продавцу👍"
5,Классный крем!
1,Крем пришёл распечатанный без слюды.
5,"Пользуюсь этим кремом очень давно. Хорошо увлажняет кожу, имеет приятный аромат. Товар в слюде, все как полагается. Не подделка. Продавца рекомендую. "
5,"Крем беру не в первый раз, запах, консистенция все нравится. Хорошо впитывается, смягчает, не вызывает аллергии."
5,"Крем очень хороший,беру не в первый раз"
5,"Отлично впитывает, лёгкий!"
4,Пахнет хорошо. Все дошло.
4,Вместо ночного пришёл дневной.
5,Рекомендую
5,"Однозначно разглаживает, буду заказывать ещё 😉 просто вау 🤩 "
5,"Крем хороший хорошо увлажняет кожу,пользуюсь уже года 3,а на ночь наношу с этой же серии ночной.мне очень нравиться.!"
5,Хороший крем. Для лета немного жирноват.
5,"Крем просто находка,пользуюсь этими кремами 5 лет,незаменимый.Рекомендую."
5,Приятный крем.
5,"Приятно пахнет. 
Жирненький, но впитывается хорошо. Нет ощущения пленки на лице. "
5,"Обыкновенный увлажняющий крем, без каких-либо чудес. Спф слабоват, от солнца не защищает особо, увлажняет неплохо, хорошо впитывается, купила уже вторую банку"
5,"Отличный крем! Хорошо впитывается , кожа увлажненная и бархатная!"
5,Косметика этой серии и фирмы очень нравится. Пользуюсь с удовольствием. Спасибо.
5,"Крем очень хороший, рекомендую. Пришло все целое. Спасибо!"
5,"В первый раз взяла такой крем , ещё не осенила его качество , Но на первый взгляд не плохой )"
5,"Отличный крем. беру уже не в первый раз. легкая отдышка, не липкий, быстро впитывается. "
5,"Крем супер,мягенький, ложится отлично, рекомендую"
5,Соответствует описанию.
5,"Срок годности хороший. Запах вкусный. Советую, раздражения нет."
5,"Отличный крем, заказываю не первый раз"
5,"Крем нравится, для сухой кожи самое то.."
5,"Пришел в коробке фирменной, запаяно, крышка на банке - тоже запаяно. Контроль вскрытия не поврежден, никто не открывал крем. Дешевле здесь намного, чем в МК."
5,"В целом крем хороший, для меня немного в летний период жирноват, лицо блестит сильно "
5,"Жирноват, а так отличный"
5,Отличный товар .
5,Любимый кремушек по приятной цене)
5,Пользуюсь боллее 2х лет.крем осень нравится
5,"Жирный,не особо быстро впитывается,ожегов нет как писали ранее!"
5,Огромное спасибо за товар!
5,"Беру уже третью баночку, вписывается прекрасно, кожа бархатная, но спф слабенький"
5,Как в магазине
5,"Отличный крем, постоянно его беру, хорошо увлажняет."
4,Очень жирный.
5,"Крем хороший, пахнет тоже очень приятно, но нет защитной пленки.
При нанесении на лицо немного щипал с минуту, но увлажняет кожу очень хорошо.
Но за такие деньги неплохой вариант."
5,Хорошо увлаюняющий крем.
5,"Хорошо упакован, спксибо продав..."
5,"Вроде неплохой, пока не поняла . Хорошо упакован"
5,"Отличный, легкий кремушек:)"
2,"Не довольна заказом. Крем пришёл без защитной фольги, открыт был, как будто даже не целый. Коробка вся мятая, грязная. Первый раз сталкиваюсь с таким товаром на Вайлдберриз. Не приятно(( Возврат не стала оформлять т.к. открывала его на работе. Думаю, что не оригинал"
5,"Крем пришёл в упаковке, годен до 25 года, не старый. Супер!!! Покупаю не первый раз, не разочарована."
5,Хороший крем рекомендуется 👍
5,"Хороший, беру не первый раз"
5,"Пользовалась этим кремом всю зиму, теперь приобрела еще один на следующую осень-зиму. Летом пользуюсь гелем для лица той же фирмы. Очень хорошо увлажняет кожу в мои 40 лет."
5,Любимый крем
5,Отличный крем!
5,"Крем нравится, спасибо."
5,"Спасибо , пришло все целое "
5,"Крем очень хороший, спасибо продавцу."
4,"Пришёл целый. Пахнет хорошо. Но для меня жирный. Лицо как блин, под тональный крем не очень. Пудрой закрепляется плохо. Подойдёт тем, кому надо прям напитать кожу. "
5,"Упакован в специальную коробочку, рада что упаковка стала достойной."
5,Все отлично упаковано
5,Рекомендую
5,Всё хорошо
5,Взяла в первые. Крем потрясающий. Кожа как у девочки. Советую.
5,"Хороший кремушек,  кожа стала выглядеть более ухоженной  чистой, такая мягкая и бархатистая, как кожа младенца, мне очень понравился крем, хорошо впитывается, никаких высыпаний нет и ничего не щиплет, как обычно у меня бывает после других кремов, это большой плюс, потому что у меня такая кожа что ничего не подходит, ни крема, ни патчи ни маски, сразу покрываюсь пятнами, что с лицом проблема что с руками. После крема кожа выглядит отдохнувшей и сияющей,  пахнет приятно, хочу ещё ночной заказать, маску приобрела для лица  ещё раньше крема, но всё боялась рисковать, ну если на крем аллергии нет , можно и маску применить. А скажите пожалуйста  есть крем для рук?"
5,"Норм, но Россия"
1,"Крем-подделка, так как нет целлофана на коробке, и вокруг глаз - тоже...Кожа, прекрасная (чистая, бархатная) после магазинного крема стала прежней после «Вайлдберисного» ненастоящего крема...Так разочарована: купила 3 банки Гиалурона Эксперта и 2 - Гиалурон вокруг глаз...Больше так не попадусь...😱"
5,"Крем заказывала для мамы. Пахнет очень приятно. Все целое, пришло быстро. Спасибо большое 💐"
2,"Крем забивает поры, после 2х дней применения покрылась мелкими прыщами. Не рекомендую"
5,"Отличный крем, все хорошо упаковано"
5,"Спасибо,отличный крем,беру не в первый раз."
5,Хороший крем. Очень довольна. Рекомендую к покупке.
3,"Крем в хорошем состоянии, но упаковка была рваная и не запечатанная в плёнку. Неприятно "
5,Приятный запах. При использовании покажет себя.
5,"Хорошо впитывается  , текстура жирная"
5,Запах крутой 😍
5,"На лето отлично, хорошо увлажняет, лёгкий!"
2,"Выбирала по отзывам, в итоге моей коже совсем не подошёл. Запах и текстура вроде ничего, но на лице после него можно блинчики жарить, - неприятный блеск. Пыталась несколько раз наносить в разные дни, в итоге каждый раз на следующий день прыщами лоб покрывался, кожа комбинированная. Наверное цена только за стеклянную баночку. Домазываю на тело, на нем такой блеск выглядит вполне уместно :)"
5,Отличный крем
1,"У меня ощущение, что это подделка. Раньше пользовалась этим кремом и не было таких реакций, а тут лицо щипит и он жирный очень оказался. К тому же совсем не запечатан."
5,"Пользуюсь давно,довольна! Спасибо!"
5,Крем хороший 
5,Крем хороший. Приятный запах.
5,"Отличный крем, лёгкая текстура. Рекомендую."
3,"Крем достаточно плотный и жирный, у кого проблемная и жирная кожа не советую."
5,"Крем хорошо упаковали, доставка быстрая , всё целое и срок годности хороший до 25г"
5,"Всё супер, упакован отлично, не повреждён, пришёл вовремя, без задержек, ничем не отличается от магазинного, если только ценой. "
5,Очень приятный крем по сносной цене. Радует)
2,"Не зря говорят, реклама - двигатель торговли! Так оно и есть. 
Морщины не разглаживаются, пользовалась не менее 4 мес, а ничего не изменилось."
5,Крем понравился!!!
1,"Крем отличный, но пришёл без упаковки производителя, то есть на коробке крема отсутствовал упаковачная слюда. Поэтому отказ. Почему за ваш косяк удержано при возврате 50 рублей "
5,"Пришли мои карандашики, очень понравились, держутся тоже классно"
5,Хороший крем!
5,"Постоянно покупаю , кожа супер "
5,Отличный крем . запах и текстура приятные 
2,"Не первый раз беру крем. Обычный. Бюджетный. Но вот упаковка подозрительная - нет защитной упаковочной плёнки, наклейка легко приклеивается и отклеивается. В самой баночке нет защитной крышечки, такой плоской. И маркёр так же легко отклеивается и приклеивается при повороте крышки. Сам крем налит вроде аккуратно, не тронут. Подделка? Или кто-то уже вскрывал? Надо бы отказаться, да заморачиваться и платить за возврат ещё не хотелось. Надеюсь, кожа не облезет. "
5,Очень классный крем!
5,"Крем замечательный, в меру жирненький, хорошо впитывает я. Буду заказывать ещё"
5,"Пришёл целый,все хорошо "
5,"Все хорошо упаковано, нанесла пока не вызвало аллергии, буду смотреть дальше"
5,Хороший продукт
5,хороший крем
5,"Хороший крем, пришел в коробочке, целый, не открытый."
5,Мне нравится!
4,"Упаковка без повреждения, все пломбы на месте"
5,Товар упакован идеально. Спасибо!
5,"Спасибо большое за крем. Пришло быстро, в отличном состоянии. К сожалению еще не успела протестировать."
5,Крем чудесный. Советую всем дамам бальзаковского возраста.
5,"Крем отличный.Хорошо увлажняет,на него хорошо ложится пудра.Запах приятный"
5,То что ожидала
5,"Обожаю этот крем) 
Всё хорошо) 
Спасибо)"
5,"Пришёл в дополнительной коробочке - упаковке, спасибо! Брала в подарок 🎁"
5,Всё супер.
5,Самый хороший крем!!!! Люблю его!!!!
4,"Упакован в пыльный пакет. Неприятно. Хорошо, что ещё был в коробке. А тушь вообще не упакована. Может её использовали? Тушь необходимо упаковывать, чтобы была уверенность."
5,"ВСЕ НОРМАЛЬНО,СПАСИБО!"
5,"Крем жирненький. Когда использую только его, лицо блестит. Но попробовала сначала наносить гель-концентрат, эффект отличный. Крем после него впитывается моментально. При совместном использовании пропала межбровная морщинка. В общем заказываю второй раз)"
5,Все хорошо
5,"Хороший крем , жирненький немного , хорошо ложился на него тональный крем , не для жирной кожи "
2,"Заказала дневной крем, отличается от моего, купленного в магазине, по цвету и не было защитной пленки (фольга) есть сомнения в подделке."
5,"Крем отличный!Нейтральный запах. Хорошо увлажняет кожу. Подходит, как основа под макияж."
5,Пользуюсь постоянно  мне подходит
5,"Крем хороший, давно им пользуюсь,но обычно брала в магазине за 480р🙈 ,увидела что здесь он 313р. решила попробовать. Крем точно такой же,мне нравится его нежный тонкий запах и текстура, единственное если вы пользуетесь тональным кремом, дайте минут 5 чтоб крем впитался,потом наносите тональный крем иначе скатается крем в катышки)) 
Теперь о минусах - пришел без упаковки, могли бы хотя бы в прозрачный пакетик положить и заклеить, коробка была грязная помятая и вскрытая, причем видно что целеноправленно. А так как крем ,под крышкой идет без защитной фольги,и крем в доступе,то это не очень приятно. Хотя многие пишут что упаковка хорошая,может это проблема не в продавце,а где то в пути вскрыли((
Позже попробую ещё раз заказать."
3,"Крем для комбинированной кожи тяжёлый и плотный, особенно для лета."
3,"Такое чувство,что крем подделка. До этого покупала его в магнит косметик и в нем присутствовала отдушка приятная, а в этом креме ее нет, это странно и прыщи повылазили.."
5,👍👍👍👍👍👍👍
5,"Отличный крем ! Для кого плотная текстура , не впитывается, очень жирный и тд . Вы значит не умеет наносить крем ! Наносить надо супер тонким слоем и будет все класс . Очень питательный,увлажняющий крем , думаю и под тональный крем тоже очень хорошо подойдет . И цена отличная (282р), в магнит косметике такой (550р) стоит)"
4,"Хороший крем. Но для дневного мне показалось слишком плотная текстура, после него  остаётся жирный блеск на лице."
5,Мне нравится этот крем. Впитывается хорошо.
5,"Товар пришёл  хорошо упакованный, не вскрытый. Брала впервые, кожа комбинированная, немного блеск остаётся на коже, но если по меньше слой наносить, то норм. От солнца защищает, а мне это и надо было👍 думаю, что буду брать ещё раз"
1,"Пришел без защитной пленки,стикер был порван.его уже открывали.либо открывали,либо это подделка!"
5,Крем хороший
5,Упакована отлично. Крем сам класс
5,"Отличный крем! Давно пользуюсь. Пришёл хорошо упакованный, срок годности в порядке!"
5,Хороший крем
5,"Спасибо большое за доставку товара в срок и упаковку! Все отлично! Кремом пользуюсь давно, рекомендую! 👍👍👏"
5,"Соответствует описанию , пришло целое , только коробка помята."
4,"Приятный крем, хорошо наносится. Но особого эффекта не заметил."
5,"Крем мне понравился,стоит взять😉буду покупать ещё ☺️"
