Star,Feedback5,Всё целое крем чудесный
5,Отлично упакован. Не пробовала.
5,"Товар отличный, пришел в целой коробочке. "
5,"Крем приятный, чувствую что питает."
5,"Мне крем нравится!)
Хорошо увлажняет, питает!
По цене доступно. Рекомендую!"
5,Отличный крем хорошо увлажняет кожу
5,"Срок годности в порядке, на самой банке его нет,но есть номер такой же как на коробке рядом со сроком годности. Защитной фольги нет,есть наклейка продолжение этикетки. И сама коробочка без пленки. Крем неплохой,аромат достаточно сильный и держится очень долго. Похож на какой то цветочный парфюм, думаю может надоесть. Сам крем достаточно жирненький."
5,Крем отличный. Результат очевидный.
5,Крем хороший.
5,Хорошо увлажняет и питает
5,Все отлично
1,Даже не знаю что ещё раз написать! 
5,Крем  отличный)))
5,Пользуюсь несколько лет. Очень нравится 👍
1,"Крем пришел без слюды, без фольги под крышкой. Качество коробки более дешевле.
Консистенция крема хуже, более жидкая, липкая. Банка отличается. Ставлю 1 звезду, крем не оригинал. Больше брать не буду. Разочаровал."
5,"Замечательный крем, нежный, ароматный, прекрасно увлажняет кожу. "
5,Все в целости сохраности.
5,Мне тоже понравилось! Не думала что такое хороший....ещё куплю!
5,Крем понравился. Возьму ещё
5,"Крем заказала во второй раз. Первая упаковка без нареканий. Крем хороший. Во второй заказ упаковка пришла вскрытая, баночка на половину пустая...  После чьих-то грязных рук , однозначно в мусорку! Лучше купить в магазине и не нервничать!"
5,"Крем понравился, текстура мягкая. Сроки в норме. Транспортировка без претензий"
5,Всё хорошо запакованно.Крем хороший.
5,"Крем пришёл хорошо упакованный,качество крема понравилось,но запах сильный и меня к сожалению раздражает..."
5,Класс .биру уже второй раз
5,Доставка очень быстрая
5,Понравилось
5,"Крем хороший! Привезли хорошо упакованный! Невскрытый. Но заметила, что сверху под крышкой нет пластинки , открываешь и сразу крем. Видимо экономят на этом. "
5,"Крем очень понравился, хорошо впитывается, не оставляет жирного блеска, не забивает поры и не скатывается, как ночной из этой же серии. Беру уже не первый раз, однозначно рекомендую к покупке!"
5,"Запах классный, впитывается хорошо, но моя кожа блестит, к сожалению"
5,Рекомендую
5,Беру его постоянно. Хороший крем.
5,Качественный крем. Очень понравился. Хорошо и быстро впитывается. Не жирный.
5,Очень нравится текстура и запах. Рекомендую
5,"Беру второй раз, эффект есть"
5,"Крем пришол в хорошем состоянии ,упаковка целая. Спасибо большое. Ставлю 5 звёзд"
5,Хороший крем.
5,"Пришел быстро, хорошо упакован; запаян в целофане, коробочка целая, также заклеена, крышка одна-верхняя, текстура крема хорошая, легкая, впитывается сразу без жирных следов."
5,"Всем довольна,спасибо "
5,"Товар пришёл хорошо упакован, без повреждений.. ещё не использовался . Запах очень приятный )"
5,"Товар пришёл в целой упаковке. Приятный запах, мягкий эффект. Соответствует описанию"
5,Хороший крем
5,Отличный крем
5,"Крем пришёл в целости и сохранности, коробка целая. Быстро впитывается, очень приятный запах. "
5,Такой фирмой Крема пользуюсь давно. Очень подходит моей коже. Цена устраивает. Спасибо!
5,В целом неплохо
5,"Крем мне понравился. Не знаю как на лето, но сейчас зимой кожа сухая очень. Хорошо увлажняет, не липкий, не жирный. И немного подсвечивает."
1,"Не надо свои штрих кода ТАК КЛЕИТЬ НА КОСМЕТИКУ. ЭТО НЕ 10-ти рублевые, что после снятия ваших штрих кодов в руки взять противно"
5,Очень хороший крем
5,Отличный крем. Подошёл идеально. Запах очень приятный. Пользуюсь с удовольствием.
5,"Хороший крем,без резкого запаха.Хорошо увлажняет"
5,Мне нравится! Хороший крем.
2,"Заказывала 3 крема: ночной, дневной и вокруг глаз. К ночному нет претензий. Пришёл хорошо упакованный, в целлофане, коробка целая, никаких изъянов. Дневной крем пришёл в помятой коробке, без целлофана. Пломбы были, но когда открыла баночку, создалось такое впечатление, что им уже кто-то пользовался, неполная баночка, мягко говоря. Крем вокруг глаз  получила и без целлофана, и без пломб. Как не стыдно продавцу отправлять товар в таком виде. Заказывала и раньше, но такое в первый раз вижу."
5,"Крем очень понравился. Приятно пахнет. Не жирный, но увлажняет просто на отлично. Брала вместе с тоником такой же серии, дак тоник тоже классный"
5,👍Мне нравится этот крем. Пользуюсь не первый раз. Рекомендую!
3,Дневной не было в пактиках никаких даже в упаковке ! 
5,Хороший крем!
5,"Тонкий аромат,нежный крем,мне понравился 👍"
5,"Крем хороший, упакован отлично."
5,Все замечательно
5,"Крем шикарный, приятный запах😍"
5,Крем хороший 👍
4,Не подошёл  раздражение и зуд
5,Кремом довольна.
5,"Ну как так WILDBERRIES 😪заказывала день ночь  ,а мне ночь ночь ,очень расстроилась 😭"
5,Отличный крем
5,"Отлично! Покупал супруге, очень довольна"
5,Обалденные крем. Упаковка под пломбами. Но коробка мятая. Стоило бы быть поаккуратнее при доставках.
5,Хороший крем
5,Крем супер. Для очень сухой кожи прямо номер 1. Ощущение свежести и подтянутости. Рекомендую у кого сухая кожа.
5,Всё отлично. Спасибо
5,Понравился.
5,👍👍👍❤️❤️❤️👍👍👍❤️
5,Кремом довольна.
5,Как всегда отличный крем
5,Очень понравился
4,Пришёл кремушек без слюды .Надеюсь  в баночке именно то что надо. Пользуюсь узнаю.
5,"Пришло целое , беру маме ей очень нравится)"
5,"Хороший крем наносится легко, не жирный. Пришел без следов вскрытия, упакован хорошо."
5,Круто увлажняет пользуюсь уже два года
2,"Коробка вскрыта, отказ"
5,"Цена хорошая, дешевле чем в магнит косметик. И на этом пожалуй всё, не подошёл, началась сыпь на лице."
5,Спасибо большое
5,"Доставка быстрая, упакован хорошо,целый. Приятный запах,жирненький ."
5,"Крем хороший,пришло все упакованное.Хорошо увлажняет"
5,"Запах лично мне не понравился, прям чувствовала его на себе и было неприятно. А так хороший. Что это за компонент такой, интересно."
4,"Крем хороший,вписывается быстро,кожа бархатная после него,запах очень приятный. Спасибо:)))"
3,"Беру не впервые,но на этот раз пришел без слюды( только ты пакете запаенном.Крышку открыла замок( наклейка) не оторвался.Есть сомнения теперь,но буду надеяться,что я первая пальчики в банку запустила"
5,"Увлажняет кожу хорошо. В меру жирный. Немного щипет сначала, видимо индивидуальная реакция на крем."
5,Хороший мягкий быстро впитывается
3,"Упаковка и доставка норм.Крем хорошо впитывается, увлажняет.Запах на первый взгляд хороший из баночки.На лице - для меня навязчивый."
5,"Беру не первый раз, отличный крем."
1,Поделка!!!
5,"Крем пришёл целый,упаковка не мятая ,посмотрим как будет в деле.Беру первый раз"
5,"Спасибо, все пришло вовремя."
1,"Это какой-то ужас прям, пришло все целое, но по ходу просрочено, или даты перебили, кожа после 2 применений стала покрываться прыщами, а от тоника этой же серии вообще пошло раздражение. По ходу на РЦ  вайлдбериз сливают контрафакт, я вся в алергии, лицо все в пятнах, хотя сама продукция купленная не здесь очень нравится! В целом эта серия вся контрафактная, все выкинула!! Деньги на ветер!!"
4,"Крем пришёл без упаковки вообще, коробка вся помята. Если берете на подарок, то такой не подаришь. Я брала себе, внутри все целое. Но все таки, упаковывайте как следует, чтобы был товарный вид."
1,"Честно говоря ничего не поняла. Нанесла крем-лицо блестит, как будто пленка липкая и через час уже хочется смыть. Повелась на отзывы."
4,"Снимаю звезду за отсутствие пленки и фольги упаковочной. Такое ощущение, что крем вскрывали.
Но сам крем норм, уже года 2 пользуюсь."
5,Все отлично
1,"Не оригинал. Даже с упаковкой проблемы. Все надписи стёрлись. Тот крем который я покупала в Летуаль совсем другой даже по консистенции,ну и упаковка в порядке была. "
5,Приятный крем. Рекомендую к покупке.
5,"Нравится,пользуюсь всей  серией этих кремов"
5,Классный крем
5,Хороший крем.
5,Хороший крем.
5,"Крем пахнет приятно, не навязчиво, хорошо впитывается. По поводу результата разглаживания покажет только время))) покупкой довольна. Доставка быстрая и хорошо упакована, ничего не помялось."
5,Всё отлично! Люблю этот крем
5,Пришло быстро. Упаковано хорошо. Запах у крема приятный. Аллергии не вызвал.Об эффекте пока ничего сказать не могу. Нужно время.
5,"Хорошо увлажняет, с приятным запахом."
5,"Не в первый раз беру этот крем, соответствует качеству, цена радует! Пришёл упакованный!"
5,"Крем понравился , рекомендую"
5,Хороший крем. Рекомендую.
5,Хороший крем.
2,"После нанесения на кожу остаётся странная отдушка с запахом какой то тухлости.. Жутко разболелась голова, этот отвратительный запах весь день стоял в носу... Дешёвая подделка. Не советую."
5,"Крем понравился, хорошо увлажняет."
5,"Отличный крем👍, описанию соответствует."
5,"Беру этот крем не первый раз  ,хороший."
5,"Крем заказывала подруге, ей нравится, постоянно покупает"
5,"Сколько перепробывала кремов,все не мои,решила попробовать этот.Влюбилась после первого применения,спасибо."
4,Хороший крем. Приятно пахнет. Звезду сняла из-за отсутствия фольги. 
5,"Крем приятный, консистенция  мягкая и нежная, легко размазывается на лице- то, как я люблю. Теперь будем ждать результат…"
5,"Пришёл в мятой коробке, без заводской упаковки ( без слюды). "
5,Крем хороший. Понравился.
5,Отличный крем
5,"Доставка быстра. Аллергии нет. Текстура нежная, быстро впитывается. Видимого эффекта моментального нет :) видимо накопительный"
5,"Брала для матери, ей понравился, говорит, для сухой кожи - самое оно. "
5,"Отличный крем,запах приятный, пришёл запакованный,беру 2 раз, рекомендую"
3,При нанесении на кожу чувствуешь запах никотина.
5,Отличный крем часто им пользуюсь
5,Крем получила. Всё целое. Пока не пользовалась. Позже напишу о результате
5,"Крем Супер, кожа становится гладенькой и нежной, плюс приятно пахнет, рекомендую."
5,Любимый дневной крем. Пользуюсь им уже много лет
5,"Отличный крем, хорошо увлажняет, подходит для сухой кожи."
5,Доставка быстрая. Пахнет приятно. Вписывается быстро. Кожа увлажненная) 🤗
5,Очень понравился крем! После нанесения кожа не жирная и не сухая. Отлично вписывается и кожа становится нежной!
5,девачки нежнятинка!! берите!! советую!!😚😋✨
5,Хороший кремушек! Увлажняет на целый день!
5,Хороший крем!
5,"Крем пришёл, не помят,закрыт 
После нанесение ,что могу сказать :в меру жирный ,после него кожа стала приятнее на ощуп ,немного липнет ,но это не критично ,сухость уже не чувствую, как с другими кремами,пахнет приятно ,будем пользоваться ."
5,"Пришло всё целое, нежный приятный запах, заказала в первый раз, ещё не пробовала. Спасибо!"
5,"Отличный крем, хорошо увлажняет."
5,"Заказываю его постоянно,отличный крем."
5,"Крем получила, спасибо"
5,Заказываю второй раз
5,"Крем, просто супер."
5,Пришёл в одной фирменной упаковке. Дополнительно не упаковали. А так всё классно. Главное целая баночка не разбилась пока доставили. Крем отличный.
5,WB огромное спасибо за быструю доставку и за выгодную цену.Упаковка не повреждена.
5,"Пришел вовремя, упаковка цела. Рекомендую."
5,"Пользуюсь не первый год, немного липкий после нанесения. Не критично. Запах приятный"
5,Хороший крем . заказывала для подарка пришел целый
5,Всегда пользуюсь этой фирмой!
5,"Крем великолепный, текстура нежная, запах приятный, впитвается хорошо, жирного блеска нет. . Лицо после него гладкое, прошло шелушение."
5,Нормальный крем 🙂
5,Классный крем. Пришел в целости
3,"Товар не подошел, появилась сыпь и воспаление, жаль заказала и дневной и ночной. "
5,Хороший крем по отличной цене
4,"Нормальный крем, но эффекта от него я думаю не увижу"
5,Крем класс/
5,"До этого брала ""возраст эксперт 35"",этот менее жирный соответственно и понравился больше. Ложиться хорошо, впитывается прекрасно.
Упаковка целая без повреждений"
5,"Товар пришёл без повреждений, хорошо упакованный в срок, спасибо продавцу. Крем отличный, хорошо ложится на кожу. Лицо после крема увлажненное и ухоженное."
5,Всё соответствует описанию
5,"Очень нравится этот крем, второй раз заказываю. Хорошо увлажняет, кожа выглядит ухоженной и морщин как-будто стало меньше. В больнице лежала, ухаживала. На улицу не выходила, не высыпалась, но с этим кремом все равно выглядела хорошо. Вообщем супер!"
5,Все отлично. Ещё закажу.
5,"Хороший крем, смегчает кожу, приятный запах"
5,"Замечательный крем, легко впитывается. Доставка быстрая"
4,"Мне крем не подошёл,   появилась красная сыпь на лице!"
5,"Вписывается хорошо, без  ощущения плёнки на лице. Не скатывается, хорошо упакован."
5,Крем хороший. На лицо ложиться идеально.
5,"Пришёл быстро, спасибо."
5,Крем хороший мне понравился
5,Крем хороший 👍 быстрая доставка
5,Крем пришёл в целости и сохранности. Спасибо.
5,Все 👍.  Хороший крем
4,"Не могу в полной мере сказать как крем ведёт себя на коже. Пробовала только раз. Вроде понравился. Но думаю отдам его маме, т. к. запах резкий и он не очень и долго ощущается после нанесения. Я чувствительная к резким запахам, мне в этом плане не подошло."
5,Все отлично.
5,Но мы товар забрали
4,"К сожалению, моей коже не подошёл. Сильно сушит."
5,Крем хороший.Понравился!
5,Отличный крем! Заказываю не первый раз! Буду ещё заказывать...
5,Вкусно пахнет 
5,Отличный крем!
5,"Качество отличное, сэкономила 100р
Буду заказывать ещё))быстрая доставка, спасибо большое."
5,Крем беру не в первый раз. Очень нравится. Отлично увлажняет и придает коже лица здоровый цвет. Советую к покупке!
5,Претензий нет
5,"Упаковка целая, срок годности для 24 года. Крем хороший, запах очень приятный"
4,"Тяжёлая текстура, не очень...Но пока не попробуешь, не узнаешь.
."
5,Отличный крем
5,Доставлено все в лучшем виде
5,Крем супер!
1,Очень обидно в таком полуиспользованном виде получить крем.Это издевательство?
5,Крем хорошо увлажняет
5,Хороший крем
5,"Очень нравится этот крем . Пришёл хорошо запакованный , всё как в магазине. Спасибо"
4,"Немного помялась коробочка, но это ерунда, главное, что крем целый и хороший, мне нравится"
5,Всё целое.Крем очень понравился. Рекомендую.
3,"Мне не подошёл к сожалению, кожа покраснела😔"
1,"Видимо, крем подходит не всем. Почитав кучу хвалебных отзывов, моя мама купила данный крем. После второго использования лицо покраснело и начало жжечь. Осторожнее выбирайте крем."
5,"Крем получила через несколько дней после заказа, большое спасибо, заказываю первый раз, взяла на пробу, рекомендую."
1,"Половины нет, на товар действует хорошая скидка, потому что кто то своими грязными руками оттуда половину достает, просто ужас."
5,"Крем понравился, мне подошёл."
5,"Пришёл - упаковка хорошая, будем пробовать, скажем, дальше какой."
5,Хороший крем. Мне понравился.
